{
  "schema": "xcodebuildmcp.output.ui-action-result",
  "schemaVersion": "1",
  "didError": false,
  "error": null,
  "data": {
    "summary": {
      "status": "SUCCEEDED"
    },
    "action": {
      "type": "tap",
      "x": 100,
      "y": 400
    },
    "artifacts": {
      "simulatorId": "<UUID>"
    },
    "diagnostics": {
      "warnings": [
        {
          "message": "snapshot_ui has not been called yet. Consider using snapshot_ui for precise coordinates instead of guessing from screenshots."
        }
      ],
      "errors": []
    }
  }
}
